id,ean,name,legal_name,unit_price,is_discounted,previous_price,origin,supplier,weight,category,age_check,alcohol_by_volume,is_new,is_pack,pack_size
66211,8480000662118,Vino tinto Casón Histórico,Vino tinto sin DOP/IGP,1.05,False,,Producto de España,"García Carrión 1890, S.L.",1.0,Bodega,True,13.0,False,False,
66107,8410261271101,Vino tinto Don Simón,Vino tinto,1.6,False,,Producto de España,JGC S.A,1.0,Bodega,True,12.0,False,False,
66710,8436612580005,Vino tinto tempranillo Elegido,Vino Tinto,2.0,False,,España,"Terra Cellars, S.L.U.",1.0,Bodega,True,13.0,False,False,
37808,8412423110068,Vino tinto Dominio de Borgia,Vino de mesa tinto,2.7,False,,España,"Bodegas Borsao, S.A.",2.0,Bodega,True,13.5,False,False,
66960,8410275002135,Vino tinto Masía de Altigón,Vino tinto,5.55,False,,Sin IGP,"Bodegas EL Villar, S.C.V.",5.0,Bodega,True,13.0,False,False,
37804,8413557700071,Vino tinto Hacienda Zargón,Vino tinto,5.55,False,,D.O. La Mancha,N.S.Manjavacas Coop.,5.0,Bodega,True,13.0,False,False,
66320,8410537200422,Vino tinto D.O Rioja El Coto crianza,Vino tinto,6.3,False,,D.O. Rioja,"El Coto de Rioja, S.A.",0.75,Bodega,True,13.0,False,False,
67112,8411767164133,Vino tinto D.O Rioja Comportillo cosecha,VINO TINTO,2.45,False,,DO Calificada Rioja,BODEGAS ONTAÑÓN S.L.,0.75,Bodega,True,,False,False,
66314,8410591002413,Vino tinto D.O Rioja Cune crianza,vino crianza,6.95,False,,Alava,CIA.VINICOLA DEL NORTE DE ESPAÑA SA,0.75,Bodega,True,13.5,False,False,
35710,8411767164294,Vino tinto D.O Rioja Comportillo crianza,Vino tinto,3.0,False,        3.25,DO Calificada Rioja,Bodegas Ontañón,0.75,Bodega,True,,False,False,
66325,8411767164096,Vino tinto D.O Rioja Comportillo reserva,Vino tinto,4.1,False,,DO Calificada Rioja,"Bodegas Ontañón, S.L.",0.75,Bodega,True,,False,False,
66346,8410537050126,Vino tinto D.O Rioja Coto de Imaz reserva,Vino tinto,8.6,False,,D. O. C. Rioja,"El Coto de Rioja, S.A.",0.75,Bodega,True,13.5,False,False,
37139,8411767020811,Vino tinto D.O La Mancha Fidencio,Vino Tinto,1.35,False,,Denominacion de origen La Mancha,Virgen De Las Viñas Bodega Y Almazara S.C. De Clm,0.75,Bodega,True,13.0,False,False,
37134,8410702000215,Vino tinto D.O Valdepeñas Viña Albali crianza,Vino,2.7,False,        2.95,D.O.P. VALDEPEÑAS,"FELIX SOLIS, S.L.",0.75,Bodega,True,13.0,False,False,
13875,8410415370728,Vino tinto D.O Valdepeñas Pata Negra reserva,Vino tinto Reserva D.O.P Valdepeñas,2.75,False,        2.95,R.E.CLM 96/CR,Embotellado por Grupo de Bodegas Vinartis SA,0.75,Bodega,True,13.0,False,False,
35730,8410415510629,Vino tinto D.O Valdepeñas Señorío de los Llanos crianza,Vino tinto Crianza DO Valdepeñas,2.25,False,,Producto de España,GRUPO DE BODEGAS VINARTIS S.A,0.75,Bodega,False,12.5,False,False,
37160,8410702051927,Vino tinto D.O Valdepeñas Condado de Egara reserva tempranillo,Vino,2.0,False,,D.O.P. VALDEPEÑAS,"FELIX SOLIS, S.L.",0.75,Bodega,True,13.0,False,False,
37166,8480000371669,Vino tinto D.O Méntrida Mimbral reserva,Vino Tinto,3.0,False,,Denominación de Origen Protegida Méntrida,Bodegas Santa Elisa,0.75,Bodega,True,14.0,False,False,
37164,8414601138574,Vino tinto D.O La Mancha Fidencio crianza,Vino Tinto,1.65,False,,Denominacion de origen La Mancha,Virgen De Las Viñas Bodega Y Almazara S.C. De Clm,0.75,Bodega,True,13.5,False,False,
37276,8411767281144,Vino tinto D.O Ribera del Duero Abadía Mantrús crianza,VINO TINTO,4.5,False,,DO Ribera del Duero,Altos de Ontañón S.L.,0.75,Bodega,True,,False,False,
37266,8410396208201,Vino tinto D.O Arribes del Duero Hacienda Zorita crianza,Vino tinto,3.0,False,,Fermoselle - Zamora,"MARQUÉS DE LA CONCORDIA FAMILY OF WINES, S.L",0.75,Bodega,True,14.0,False,False,
37277,8411767281151,Vino tinto D.O Ribera del Duero Abadía Mantrús reserva,VINO TINTO,6.0,False,,DO Ribera del Duero,Altos de Ontañón S.L.,0.75,Bodega,True,,False,False,
37262,8410261169064,Vino tinto D.O Ribera del Duero Arribeño roble,Vino tinto DOP Ribera del Duero Roble,3.65,False,,Producto de España,Bodegas 1890,0.75,Bodega,True,13.5,False,False,
22500,8480000225009,Vino tinto D.O Ribera del Duero Atardecer roble,Vino tinto,4.1,False,        4.20,Denominación de origen Ribera del Duero,Bodegas  Vilano S.C.,0.75,Bodega,True,14.5,False,False,
67024,8412423121705,Vino tinto D.O Campo de Borja Borsao barrica,Vino tinto D.O. Campo de Borja,2.25,False,,D.O. Campo de Borja,Bodegas Borsao,0.75,Bodega,True,14.5,False,False,
66673,8008820151911,Vino tinto dulce de aguja Sangue di Giuda Cueva peccato,Vino de Aguja Tinto Dulce,3.9,False,,DOC Oltrepo' Pavese,Vinicola Decordi Del Borgo,0.75,Bodega,True,7.0,False,False,
37156,8410702049603,Vino tinto tempranillo El Mandamás The Guv'Nor,Vino,2.85,False,,VINO VARIETAL SIN DOP / IGP,"FELIX SOLIS, S.L.",0.75,Bodega,True,14.0,False,False,
37201,8414318910159,Vino tinto tempranillo Fin del Río Fariña,Vino tinto,2.3,False,,España,"Bodegas Fariña, S.L.",1.0,Bodega,True,12.5,False,False,
37005,8435065600209,Vino tinto sin sulfitos añadidos Davida D.O. Navarra,Vino tinto,3.9,False,,D.O. Navarra,Vintae Luxury Wines,0.75,Bodega,True,14.0,False,False,
23677,8480000236777,Vino tinto Merlot Mar de Uvas,Vino tinto Merlot,2.4,False,,CASTILLA LA MANCHA,JUAN RAMON LOZANO S.A.U.,0.75,Bodega,True,13.5,False,False,
23676,8480000236760,Vino tinto Syrah Mar de Uvas,Vino tinto Syrah,2.35,False,,CASTILLA LA MANCHA,JUAN RAMON LOZANO S.A.U.,0.75,Bodega,True,13.5,False,False,
67507,8411789031444,Vino tinto D.O Cariñena Sierra de Viento roble,Vino tinto roble DOP Cariñena,1.65,False,,,BODEGAS SAN VALERO S. COOP.,0.75,Bodega,True,13.5,False,False,
66349,8410744008675,Vino tinto Caperucita tinta Torre Oria suave,Vino Tinto,1.95,False,,Varietal,Torre Oria SL,0.75,Bodega,True,12.5,False,False,
70727,8480000707277,Vino tinto Bobal Para Pecar,Vino tinto,2.9,False,,España,"Vicente Gandia Pla, S.A.",0.75,Bodega,True,14.0,False,False,
66295,8410744008118,Vino tinto D.O Utiel-Requena Torre Oria crianza,Vino Tinto Crianza,2.0,False,,D.O. Utiel Requena.,Torreoria S.L.,0.75,Bodega,True,13.0,False,False,
37217,8414318902765,Vino tinto D.O Dama de Toro Fariña roble,Vino tinto,3.0,False,,España,"Bodegas Fariña, S.L.",0.75,Bodega,True,14.0,False,False,
8314,8410744014188,Vino tinto Niche Garnachas Seleccionadas,Vino Tinto,2.7,False,,,Torre Oria SL,0.75,Bodega,True,14.0,False,False,
37002,8411767805104,Vino rosado D.O Navarra Hypatia,Vino rosado,2.1,False,,DO Navarra,BODEGAS SEÑORÍO DE FITERO,0.75,Bodega,True,,False,False,
37153,8414601138383,Vino rosado D.O La Mancha Fidencio,Vino Rosado,1.55,False,,Denominacion de origen La Mancha,Virgen De Las Viñas Bodega Y Almazara S.C. De Clm,0.75,Bodega,True,11.5,False,False,
37802,8412423110075,Vino rosado Dominio de Borgia,Vino de mesa rosado,2.4,False,,España,"Bodegas Borsao, S.A.",2.0,Bodega,True,13.5,False,False,
67119,8411767000332,Vino rosado D.O Rioja Arteso Clarete,VINO ROSADO,3.25,False,,DO Calificada Rioja,BODEGAS ONTAÑÓN S.L.,0.75,Bodega,True,,False,False,
52533,8402001013157,Lambrusco dell'Emilia rosado espumoso Piccolo Giovanni,Vino frizzante,1.9,False,,Italia,"Vicente Gandia Pla, S.A.",0.75,Bodega,True,8.0,False,False,
66673,8008820151911,Vino tinto dulce de aguja Sangue di Giuda Cueva peccato,Vino de Aguja Tinto Dulce,3.9,False,,DOC Oltrepo' Pavese,Vinicola Decordi Del Borgo,0.75,Bodega,True,7.0,False,False,
66332,8480000663320,Vino blanco espumoso verdejo DulZ.Ze frizzante,Vino tinto,2.65,False,,,AECOC,0.75,Bodega,True,,False,False,
37212,8410849000178,Vino rosado afrutado espumoso Peñascal,Vino Rosado de Aguja,3.85,False,,Sin D.O.,BODEGAS PEÑASCAL S.A.,0.75,Bodega,True,11.5,False,False,
66127,8480000661272,Vino blanco Casón Histórico,Vino blanco sin DOP/IGP,0.9,False,,Producto de España,"García Carrión 1890, S.L.",1.0,Bodega,True,11.0,False,False,
66124,8410261206189,Vino blanco Don Simón chardonnay airén,Vino blanco varietal Chardonnay-Airen,1.6,False,,Producto de España,J.GARCIA CARRION LM S.A.,0.75,Bodega,True,11.0,False,True,0.25
66905,8480000669056,Bebida aromatizada a base de vino para cocinar Abuela Carola,Bebida aromatizada a base de vino para cocinar,2.35,False,,,"Bodegas EL Villar, S.C.V.",0.75,"Aceite, especias y salsas",True,14.0,False,False,
66105,8410261273105,Vino blanco Don Simón,Vino blanco,1.6,False,,Producto de España,JGC S.A,1.0,Bodega,True,11.0,False,False,
66711,8436612580012,Vino blanco airén verdejo Elegido,Vino Blanco,2.0,False,,España,"Terra Cellars, S.L.U.",1.0,Bodega,True,11.0,False,False,
66202,8421216046118,Vino blanco Marina Alta D.O Alicante,Vino blanco,4.95,False,,Petrer,Bodegas Bocopa,0.75,Bodega,True,11.0,False,False,
37138,8411767020828,Vino blanco D.O La Mancha Fidencio,Vino Blanco,1.4,False,,Denominacion de origen La Mancha,Virgen De Las Viñas Bodega Y Almazara S.C. De Clm,0.75,Bodega,True,11.5,False,False,
37111,8414601138420,Vino blanco Chardonnay Indómito,Vino Blanco Chardonnay,2.3,False,,Sin DOP/IGP Varietal,Virgen De Las Viñas Bodega Y Almazara S.C. De Clm,0.75,Bodega,True,13.0,False,False,
66324,8410537600727,Vino blanco D.O Rioja El Coto,Vino,4.15,False,,D. O. C. Rioja,"El Coto de Rioja, S.A.",0.75,Bodega,True,12.0,False,False,
37110,8410415510612,Vino blanco crianza D.O Valdepeñas Señorío de los Llanos,Vino blanco Crianza DO Valdepeñas,2.2,False,,Producto de España,GRUPO DE BODEGAS VINARTIS S.A,0.75,Bodega,True,12.5,False,False,
67125,8480000671257,Vino blanco albariño D.O Rías Baixas Pazo de Orantes,Vino Blanco Albariño,6.0,False,,D.O. Rías Baixas,Adega Condes de Albarei S.A.U.,0.75,Bodega,True,12.5,False,False,
67123,8410275002005,Vino blanco D.O Valencia Finca La Malcriada dulce,Vino blanco dulce,2.6,False,,DOP Valencia,"Bodegas EL Villar, S.C.V.",0.75,Bodega,True,11.0,False,False,
66836,8437003519154,Vino blanco D.O Rías Baixas albariño Ponte Tamuxe,Vino blanco.,7.45,False,,Denominación de origen Rías Baixas.,"Adegas Tollodouro, S.A.",0.75,Bodega,True,12.5,False,False,
66846,8480000668462,Vino blanco Godello D.O. Monterrei Mar de Uvas,Vino blanco,6.5,False,,Denominación de origen Monterrei,"Crego e Monaguillo, S.L.",0.75,Bodega,True,13.0,False,False,
67933,8480000679338,Vino blanco D.O Somontano Atardecer Chardonnay,Vino Blanco,3.5,False,,D.O Somontano,"Bodega Sommos, S.L",0.75,Bodega,True,13.5,False,False,
66851,8480000668516,Vino verde Loureiro D.O Portugal Castelo de Moinhos,Vino Verde,2.5,False,,Portugal,Producido y embotellado por: Adega Cooperativa de Ponte de Lima,0.75,Bodega,True,11.5,False,False,
86547,8437012660113,Vino blanco viura y tempranillo D.O Rioja Ponce de Albayda,VINO BLANCO FERMENTADO EN MADERA,4.25,False,,La Rioja,BODEGAS PROELIO,0.75,Bodega,True,14.0,False,False,
37229,8410261172002,Vino blanco verdejo D.O Rueda Arribeño,Vino blanco DOP Rueda,1.9,False,,Producto de España,BODEGAS Y VIÑEDOS MAYOR DE CASTILLA S.L.,0.75,Bodega,True,13.0,False,False,
66369,8411767281045,Vino blanco verdejo D.O Rueda Abadía Mantrús,Vino blanco,2.1,False,,DO Rueda,Altos de Ontañón S.L.,0.75,Bodega,True,,False,False,
37218,8411767281038,Vino blanco D.O Rueda Abadía Mantrús Sauvignon Blanc,Vino blanco,3.0,False,,DO Rueda,Altos de Ontañón S.L.,0.75,Bodega,True,,False,False,
23279,8480000232793,Vino blanco verdejo D.O Rueda Condado de Teón,VINO BLANCO,3.8,False,,DO Rueda,Altos de Ontañón S.L.,0.75,Bodega,True,,False,False,
66495,8410310615795,Vino blanco suave y afrutado El Pescaito,Vino blanco,2.1,False,,España,"VICENTE GANDIA PLA, S.A.",0.75,Bodega,True,10.0,False,False,
66352,8410106023254,Vino blanco semidulce Diamante D.O Rioja,Vino blanco,4.3,False,,Denominación de origen La Rioja,"Bodegas Franco Españolas, S.A.",0.75,Bodega,True,12.5,False,False,
67144,8412276386672,Vino blanco semidulce Allegretto Alba,VINO BLANCO SEMIDULCE,2.0,False,,España,Anecoop S. Coop.,0.75,Bodega,True,11.0,False,False,
66912,8412449104430,Vino dulce Pedro Ximénez Real Tesoro D.O Jerez de la frontera,VINO DE JEREZ PEDRO XIMENEZ,6.0,False,,,"JOSÉ ESTÉVEZ, S.A.",0.75,Bodega,True,17.0,False,False,
23287,8480000232878,Mistela de moscatel Mig Segle D.O Valencia,VINO DE LICOR DULCE DE MOSCATEL,3.6,False,,Denominación de Origen Valencia,Anecoop S. Coop.,0.75,Bodega,True,15.0,False,False,
39896,8480000398963,Mosto tinto Casón Histórico,Zumo de uva a partir de concentrado.,2.0,False,,,J.G.C. L.M. S.A.,1.5,Bodega,False,,False,False,
66907,8411203042445,Vino fino Corredera D.O Montilla-Moriles,Vino,2.85,False,,D.O.P. Montilla-Moriles,"Pérez Barquero, S.A.",0.75,Bodega,True,15.0,False,False,
39488,8432286003338,Bebida refrescante aromatizada tinto sin alcohol light Castillo de Salobreña,BEBIDA REFRESCANTE AROMATIZADA. CON AZÚCARES Y EDULCORANTES. PARA DILUIR 1+2.,1.6,False,,España,Industrias Espadafor S.A.,1.0,Bodega,True,,False,False,
67901,8480000679017,Vino tinto Porto Tawny Almeida Dias,Vino de Porto Tawny,7.0,False,,Portugal,"C. da Silva, Vinhos SA",0.75,Bodega,True,19.0,False,False,
66922,8480000669223,Sangría Casón Histórico,Sangría,1.6,False,,Producto de España,"García Carrión 1890, S.L.",1.5,Bodega,True,7.0,False,False,
60748,8480000607485,Tinto de verano zero limón Casón Histórico,Vino Tinto,1.0,False,        1.15,,"J.G.C.,S.A.",1.5,Bodega,True,,False,False,
66944,8410261151625,Sangría Don Simón,Sangría,2.1,False,,Producto de España,J. GARCIA CARRION LM S.A,1.5,Bodega,True,7.0,False,False,
66746,8410261152417,"Tinto de verano 0,0% sin alcohol limón Don Simón",Bebida de zumo de uva. Con edulcorantes,1.4,False,,España,JGC S.A,1.5,Bodega,True,,False,False,
66747,8410261152011,Tinto de verano limón Don Simón,Bebida de vino y zumo de uva. Con edulcorantes,1.65,False,,España,JGC S.A,1.5,Bodega,True,4.0,False,False,
67818,8480000678188,Tinto de verano limón Casón Histórico,Vino Tinto,1.1,False,        1.20,,"J.G.C.,S.A.",1.5,Bodega,True,,False,False,
67819,8480000678195,Tinto de verano classic Casón Histórico,Bebida a base de vino con azúcar y edulcorantes,1.2,False,,,"Productos de Viticultura, S.A.",1.5,Bodega,True,4.0,False,False,
66739,8480000667397,Tinto de verano sabor limón Casón Histórico,Bebida de vino y zumo de uva y limón. Con edulcorantes.,3.3,False,,Producto de España,JGC S.A,1.98,Bodega,True,4.0,False,True,0.33
66738,8480000667380,Tinto de verano sabor limón Casón Histórico,Bebida de vino y zuma de uva y limÃ³n. Con edulcorantes.,0.55,False,,,"J.G.C.,S.A.",0.33,Bodega,True,4.0,False,False,
66742,8480000667427,Tinto de verano zero limón Casón Histórico 0% alcohol 0% azúcares,Bebida refrescante aromatizada. Con edulcorantes. Sin alcohol. Sin azúcares.,3.3,False,,España, JGC S.A,1.98,Bodega,True,,False,True,0.33
66741,8480000667410,Tinto de verano zero limón Casón Histórico 0% alcohol 0% azúcares,Bebida refrescante aromatizada. Con edulcorantes. Sin alcohol. Sin azúcares.,0.55,False,,Producto de España,JGC S.A,0.33,Bodega,True,,False,False,
28059,8410283314244,Tinto de verano sabor limón La Casera,"Bebida de vino tinto, mosto y zumo de limón. Con edulcorantes.",4.5,False,,,"Schweppes, S.A. ""Envasado con licencia de Schweppes International Limited.""",3.0,Bodega,True,3.4,False,True,1.5
27843,8410283346504,Tinto de verano sabor limón La Casera,"Bebida de vino tinto, mosto y zumo de limón. Con edulcorantes.",2.3,False,,,"Schweppes, S.A. ""Envasado con licencia de Schweppes International Limited.""",1.5,Bodega,True,3.9,False,False,
28515,8413481112100,Sidra asturiana El Mayu,Sidra,1.6,False,,,Manuel Busto Amandi S.A.,0.75,Bodega,True,4.1,False,False,
23863,8413481510173,Sidra asturiana El Mayu,Sidra,10.8,False,,,Manuel Busto Amandi S.A.,3.0,Bodega,True,4.1,False,True,0.25
23862,8413481010178,Sidra asturiana El Mayu,Sidra,0.9,False,,,Manuel Busto Amandi S.A.,0.25,Bodega,True,4.1,False,False,
28898,8480000288981,Sidra natural Polían,Sidra,1.95,False,,,"Sidra Menendez, S.L.",0.7,Bodega,True,6.5,False,False,
28921,8480000289216,Cava brut Cabré & Sabaté,Vino blanco DOP Cava brut,2.95,False,,Producto de España,BODEGAS JAUME SERRA S.L.,0.75,Bodega,True,11.5,False,False,
22977,8480000229779,Cava brut Cabré & Sabaté,Vino blanco DOP Cava Brut,1.65,False,,Producto de España,JAUME SERRA,0.2,Bodega,True,11.5,False,False,
28908,8411277063049,Cava brut nature Jaume Serra,Cava Brut Nature,4.25,False,,España,BODEGAS JAUME SERRA S.L.,0.75,Bodega,True,11.5,False,False,
28969,8410013261015,Cava brut Anna Codorníu,Cava,9.35,False,,Producto de España,ELABORADOR CODORNIU S.A.,0.75,Bodega,True,11.5,False,False,
28938,8480000289384,Cava brut nature reserva vintage Cabré & Sabaté,Vino blanco DOP Cava brut nature,4.45,False,,Producto de España,BODEGAS JAUME SERRA S.L.,0.75,Bodega,True,11.5,False,False,
28005,8410036800499,Cava brut Freixenet,Cava Brut,6.95,False,,D.O. Cava,"Freixenet, S.A.",0.75,Bodega,True,11.5,False,False,
28939,8480000289391,Cava semi seco Cabré & Sabaté,Vino blanco DOP Cava semi seco,2.95,False,,Producto de España,BODEGAS JAUME SERRA S.L.,0.75,Bodega,True,11.5,False,False,
28006,8410036800512,Cava semi seco Freixenet,Cava Semiseco,6.95,False,,D.O. Cava,"Elaborador Freixenet, SA",0.75,Bodega,True,11.5,False,False,
28520,8480000285201,Vermouth rojo Maronti reserva,Vermut Reserva,3.6,False,,España,Emilio Miró Salvat SA,1.0,Bodega,True,16.0,False,False,
15846,8480000158468,Vermouth blanco Maronti,Vermut Bianco,2.7,False,,España,Emilio Miro Salvat,1.0,Bodega,True,15.0,False,False,
28400,7630040405249,Vermouth bianco Martini,Vermouth,10.7,False,,Italia,"BACARDI ESPAÑA, S.A.",1.0,Bodega,True,15.0,False,False,
28401,7630040405263,Vermouth rosso Martini,Vermouth,10.7,False,,Italia,"BACARDI ESPAÑA, S.A.",1.0,Bodega,True,15.0,False,False,
28837,8480000288370,Vermouth rojo Maronti,Vermut Rosso,2.7,False,,España,Emilio Miró Salvat SA,1.0,Bodega,True,15.0,False,False,
28715,8411144101225,Ginebra London Dry Gin Larios,Ginebra,11.45,False,,España,Beam Suntory Spain S.L,1.0,Bodega,True,37.5,False,False,
28712,5000329002209,Ginebra London Dry Gin Beefeater,,13.95,False,,Reino Unido (el),Pernod Ricard España,0.7,Bodega,True,,False,False,
28032,5900685007910,Ginebra Dry Gin Seagram's,Ginebra,16.5,False,,Estados Unidos (los),Pernod Ricard España,0.7,Bodega,True,40.0,False,False,
28775,5000281015286,Ginebra London Dry Gin Tanqueray,Ginebra,15.0,False,       15.95,,Diageo España S.A.,0.7,Bodega,True,43.1,False,False,
28848,8480000288486,Ginebra strawberry Gin Glivery,Gin destilado,7.65,False,,España,"Destilerías MG, S.L.",0.7,Bodega,True,37.5,False,False,
22316,8480000223166,Ginebra sweet Gin Exotic Glivery,GINEBRA,7.65,False,,España,RIVES PITMAN SA,0.7,Bodega,True,37.5,False,False,
67632,8480000676320,Ginebra London Dry Gin Kingerly & Sons,Ginebra,6.25,False,,España,"Destilerías MG, S.L.",0.7,Bodega,True,,False,False,
52745,8402001017575,Ginebra natural & soft 1185,Ginebra,6.25,False,,Barcelona,Grandes Bebidas y Destilados S.L.,0.7,Bodega,True,40.0,False,False,
28246,8410162011127,Bebida espirituosa centenario Terry,Brandy,9.5,False,,España,"Bodegas Fundador, S.L.U",1.0,Bodega,True,30.0,False,False,
28527,8480000285270,Bebida espirituosa Convidado de Baco,Bebida Espirituosa,6.0,False,,España,"Bodegas Fundador, S.L.U.",1.0,Bodega,True,30.0,False,False,
28525,8480000285256,Brandy de Jerez solera reserva Convidado de Baco,Brandy de Jerez Solera Reserva,5.9,False,,España,"Bodegas Fundador, S.L.U.",0.7,Bodega,True,36.0,False,False,
28526,8480000285263,Brandy de Jerez solera gran reserva Convidado de Baco,Brandy de Jerez Solera Gran Reserva,9.9,False,,España,"Bodegas Fundador, S.L.U.",0.7,Bodega,True,40.0,False,False,
28604,5010106113127,Whisky escocés Ballantine's,,12.95,False,,Reino Unido (Escocia),George Ballantine & Son LTD,0.7,Bodega,True,,False,False,
28610,8410695020658,Whisky escocés Red Label Johnnie Walker,Whisky - Blended Scotch,14.5,False,       15.50,,Diageo España S.A.,0.7,Bodega,True,40.0,False,False,
28613,8410695020641,Whisky escocés J&B,Whisky - Blended Scotch,11.95,False,       12.50,,Diageo España S.A.,0.7,Bodega,True,40.0,False,False,
28662,8410490267227,Whisky escocés James Webb,Whisky,6.0,False,,,"BARDINET,S.A.",0.7,Bodega,True,40.0,False,False,
28600,8410854023452,Whisky DYC,Whisky 5 años,9.9,False,       10.50,España,Beam Suntory Spain S.L,0.7,Bodega,True,40.0,False,False,
28630,8410695028227,Whisky escocés Black Label Johnnie Walker,Whisky - Blended Scotch,28.95,False,,,Diageo España,0.7,Bodega,True,40.0,False,False,
28731,8410490001043,Ron añejo Negrita,Ron,9.25,False,,España,"BARDINET,S.A.",0.7,Bodega,True,37.5,False,False,
35919,8402001009723,Ron blanco superior La Recompensa,Rpn Blanco la Recompensa,5.25,False,,,Destilerias S. Cruz de Tenerife S.L.,0.7,Bodega,True,37.5,False,False,
28757,7461323129237,Ron dominicano añejo Ron Barceló,Ron Dominicano,15.45,False,,República Dominicana,Import. Export. Varma S.A.,0.7,Bodega,True,37.5,False,False,
28373,8410024710892,Ron caribeño sabor coco Malibu,Licor Ron,12.6,False,,España,Pernod Ricard España,0.7,Bodega,True,18.0,False,False,
86232,8480000862327,Ron añejo La Recompensa,Ron,5.95,False,,,"Destilerías MG, S.L.",0.7,Bodega,True,37.5,False,False,
86707,8480000867070,Ron viejo La Recompensa,RON VIEJO,9.5,False,,,"JOSÉ ESTÉVEZ, S.A.",0.7,Bodega,True,40.0,False,False,
28571,8480000285713,Licor crema Irlandesa Royal Swan,LIQUOR,6.0,False,,España,"BARDINET,S.A.",0.7,Bodega,True,17.0,False,False,
22614,8480000226143,Licor crema de fresa Royal Swan,Licor,6.95,False,,,"BARDINET,S.A.",0.7,Bodega,True,15.0,False,False,
28506,8480000285065,Licor crema Puente Pazos,LICOR,6.25,False,,,"JOSÉ ESTÉVEZ, S.A.",0.7,Bodega,True,15.0,False,False,
67930,8480000679307,Licor crema choco avellana Royal Swan,,6.25,False,,,,0.7,Bodega,True,,False,False,
52875,8402001017155,Licor crema Caramel Biscuit Royal Swan,Licor,7.0,False,,,"BARDINET,S.A.",0.7,Bodega,True,15.0,False,False,
13493,8480000134936,Bebida espirituosa a base de vodka Knebep caramelo,Licor,5.7,False,,,"BARDINET,S.A.",0.7,Bodega,True,20.0,False,False,
28822,8480000288226,Vodka Knebep,Vodka,6.7,False,,España,"BARDINET,S.A.",1.0,Bodega,True,37.5,False,False,
35969,8402001009525,Licor de anís dulce Dama Mayor,Anís dulce,5.75,False,        5.90,España,Bodegas y Destilerías del Sur S.A.,0.7,Bodega,True,35.0,False,False,
28381,8411144100303,Licor de anís dulce La Castellana,Anis Dulce,9.25,False,,España,Beam Suntory Spain S.L,0.7,Bodega,True,35.0,False,False,
28508,8480000285089,Licor de hierbas Puente Pazos,Licor de hierbas,6.1,False,,,"MERCADONA, S.A.",0.7,Bodega,True,30.0,False,False,
28335,8007253900660,Licor de limoncello Franzini,Licor,6.85,False,,,Dilmoor,0.7,Bodega,True,30.0,False,False,
28724,4067700028570,Licor de hierbas Jägermeister,Licor,13.65,False,       14.50,Alemania,Spirit and Brands S.L.,0.7,Bodega,True,35.0,False,False,
28507,8480000285072,Aguardiente de orujo Puente Pazos,Aguardiente de orujo,7.1,False,,,"Pazo de Valdomiño, S.A.",0.7,Bodega,True,40.0,False,False,
28432,8005130001530,Licor dulce Amaretto Del Patriarca,AMARETTO DEL PATRIARCA,4.9,False,,"PRODUCIDO POR: CIEMME LIQUORI SPA   VIA GREGORCIC, 28   GORIZIA   ITALIA",CIEMME LIQUORI S.P.A.,0.7,Bodega,True,20.0,False,False,
23593,8480000235930,Tequila Gold Santa Concepción,Tequila Gold,10.5,False,,,"BARDINET,S.A.",0.7,Bodega,True,40.0,False,False,
52471,8420010120994,Pacharán Oibar,Pacharan Navarro,6.9,False,,,"Destilerías La Navarra, S.A.",1.0,Bodega,True,25.0,False,False,
13610,8480000136107,Licor mora sin alcohol Pi.omka,MORA BEB.REFRESCANTE PIOMKA 0'7,2.8,False,,España,Alfonso Rivillas S.L.,0.7,Bodega,True,,False,False,
66462,8480000867018,Cerveza Clásica Steinburg,CERVEZA,3.72,False,,España,Brouwerij Martens,3.96,Bodega,True,4.8,False,True,0.33
66463,8480000867025,Cerveza Clásica Steinburg,CERVEZA,0.31,False,,España,Brouwerij Martens,0.33,Bodega,True,4.8,False,False,
27338,8712000011079,Cerveza Heineken,Cerveza,8.28,False,,,Heineken España S.A.,3.96,Bodega,True,5.0,False,True,0.33
27100,87120158,Cerveza Heineken,Cerveza,0.82,False,,España,Heineken España S.A.,0.33,Bodega,True,5.0,False,False,
66031,8411327122122,Cerveza especial Mahou,Cerveza especial,9.96,False,,España,"MAHOU, S.A.",3.96,Bodega,True,5.5,False,True,0.33
27136,8411327122016,Cerveza especial Mahou,Cerveza especial,0.85,False,,España,"MAHOU, S.A.",0.33,Bodega,True,5.5,False,False,
66027,8411327022125,Cerveza clásica Mahou,CERVEZA,8.64,False,,España,"MAHOU, S.A.",3.96,Bodega,True,4.8,False,True,0.33
27178,8411327022019,Cerveza clásica Mahou,CERVEZA,0.75,False,,España,"MAHOU, S.A.",0.33,Bodega,True,4.8,False,False,
28057,8410793037336,Cerveza doble malta Voll-Damm,,5.58,False,,,DAMM S.A.,1.98,Bodega,True,,False,True,0.33
27137,8410793036131,Cerveza doble malta Voll-Damm,Cerveza Extra,0.99,False,,EU,DAMM S.A.,0.33,Bodega,True,7.2,False,False,
66485,8480000664853,Cerveza Suave Steinburg,CERVEZA,3.48,False,,Francia,Brasserie de Saint-Omer,3.96,Bodega,True,5.0,False,True,0.33
66486,8480000664860,Cerveza Suave Steinburg,CERVEZA,0.29,False,,España,FONT SALEM SL,0.33,Bodega,True,4.8,False,False,
66026,8410655000874,Cerveza especial San Miguel,CERVEZA ESPECIAL,6.0,False,,España,"MAHOU, S.A.",3.96,Bodega,True,5.4,False,True,0.33
27103,8410655000010,Cerveza especial San Miguel,CERVEZA ESPECIAL,0.72,False,,España,"MAHOU, S.A.",0.33,Bodega,True,5.4,False,False,
66764,8480000667649,Cerveza Especial Steinburg,CERVEZA,4.44,False,,España,BIRC. SPA,3.96,Bodega,True,5.9,False,True,0.33
66765,8480000667656,Cerveza Especial Steinburg,CERVEZA,0.37,False,,España,BIRC. SPA,0.33,Bodega,True,5.9,False,False,
66469,4008287917925,Cerveza Pils Krombacher,Cerveza,3.6,False,,Alemania,Krombacher Brauerei Bernhard Schadeberg GMBH&Co. KG,1.98,Bodega,True,4.8,False,True,0.33
66470,4008287050530,Cerveza Pils Krombacher,Cerveza,0.6,False,,Alemania,Krombacher Brauerei Bernhard Schadeberg GMBH&Co. KG,0.33,Bodega,True,4.8,False,False,
66432,8480000664327,Cerveza doble malta,Cerveza doble malta,3.18,False,,Marruecos,"Mercadona, S.A",1.98,Bodega,True,7.4,False,True,0.33
